{
  "format": "EN16931-Semantic-JSON-binding",
  "version": "0.1",
  "syntax": "CII",
  "syntaxName": "UN/CEFACT Cross Industry Invoice D16B",
  "model": "EN16931-1",
  "edition": "EN 16931-1:2017+A1:2019/AC:2020",
  "rootElement": "rsm:CrossIndustryInvoice",
  "license": "Apache-2.0",
  "notice": "The identifiers, XPaths, supplementary component XPaths and note codes in this file are facts taken from the SeMoX model of the XRechnung CIUS published by KoSIT (Koordinierungsstelle für IT-Standards), release 2026-08-31, binding cii. No description, note text, rule or example of that model is reproduced here: every sentence in this file is the author's own wording. The licence of the model repository the facts come from is being clarified with KoSIT; see model/bindings/README.md. This file itself is Apache-2.0. ESJ is not an XRechnung format and this file is not a KoSIT deliverable.",
  "source": {
    "name": "KoSIT SeMoX model of the XRechnung CIUS",
    "file": "xrechnung-cius-model.xml",
    "binding": "cii",
    "release": "2026-08-31"
  },
  "generator": "model/bindings/tools/semox_to_bindings.py",
  "namespaces": {
    "qdt": "urn:un:unece:uncefact:data:standard:QualifiedDataType:100",
    "ram": "urn:un:unece:uncefact:data:standard:ReusableAggregateBusinessInformationEntity:100",
    "rsm": "urn:un:unece:uncefact:data:standard:CrossIndustryInvoice:100",
    "udt": "urn:un:unece:uncefact:data:standard:UnqualifiedDataType:100"
  },
  "corrections": [
    {
      "member": "terms",
      "from": "/rsm:CrossIndustryInvoice/rsm:SupplyChainTradeTransaction/ram:ApplicableHeaderTradeAgreement/ram:SellerTradeParty/ram:GlobalID[@schemeID]",
      "to": "/rsm:CrossIndustryInvoice/rsm:SupplyChainTradeTransaction/ram:ApplicableHeaderTradeAgreement/ram:SellerTradeParty/ram:GlobalID",
      "reason": "The schemeID attribute is optional in the schema of this syntax, so a document that states a global identifier without one is conformant and the condition loses the identifier rather than its scheme; BR-CO-26 then faults an invoice that does identify its seller. The CEN validation artefact of packs/ reads this element without the condition, and the scheme remains bound as the supplementary component of the term."
    },
    {
      "member": "terms",
      "from": "/rsm:CrossIndustryInvoice/rsm:SupplyChainTradeTransaction/ram:ApplicableHeaderTradeAgreement/ram:BuyerTradeParty/ram:GlobalID[@schemeID]",
      "to": "/rsm:CrossIndustryInvoice/rsm:SupplyChainTradeTransaction/ram:ApplicableHeaderTradeAgreement/ram:BuyerTradeParty/ram:GlobalID",
      "reason": "The schemeID attribute is optional in the schema of this syntax, so a document that states a global identifier without one is conformant and the condition loses the identifier rather than its scheme; BR-CO-26 then faults an invoice that does identify its seller. The CEN validation artefact of packs/ reads this element without the condition, and the scheme remains bound as the supplementary component of the term."
    },
    {
      "member": "terms",
      "from": "/rsm:CrossIndustryInvoice/rsm:SupplyChainTradeTransaction/ram:ApplicableHeaderTradeSettlement/ram:PayeeTradeParty/ram:GlobalID[@schemeID]",
      "to": "/rsm:CrossIndustryInvoice/rsm:SupplyChainTradeTransaction/ram:ApplicableHeaderTradeSettlement/ram:PayeeTradeParty/ram:GlobalID",
      "reason": "The schemeID attribute is optional in the schema of this syntax, so a document that states a global identifier without one is conformant and the condition loses the identifier rather than its scheme; BR-CO-26 then faults an invoice that does identify its seller. The CEN validation artefact of packs/ reads this element without the condition, and the scheme remains bound as the supplementary component of the term."
    },
    {
      "member": "terms",
      "from": "/rsm:CrossIndustryInvoice/rsm:SupplyChainTradeTransaction/ram:ApplicableHeaderTradeDelivery/ram:ShipToTradeParty/ram:GlobalID[@schemeID]",
      "to": "/rsm:CrossIndustryInvoice/rsm:SupplyChainTradeTransaction/ram:ApplicableHeaderTradeDelivery/ram:ShipToTradeParty/ram:GlobalID",
      "reason": "The schemeID attribute is optional in the schema of this syntax, so a document that states a global identifier without one is conformant and the condition loses the identifier rather than its scheme; BR-CO-26 then faults an invoice that does identify its seller. The CEN validation artefact of packs/ reads this element without the condition, and the scheme remains bound as the supplementary component of the term."
    },
    {
      "member": "terms",
      "from": "/rsm:CrossIndustryInvoice/rsm:SupplyChainTradeTransaction/ram:ApplicableHeaderTradeAgreement/ram:AdditionalReferencedDocument",
      "to": "/rsm:CrossIndustryInvoice/rsm:SupplyChainTradeTransaction/ram:ApplicableHeaderTradeAgreement/ram:AdditionalReferencedDocument[ram:TypeCode = '916']",
      "reason": "The syntax writes the tender or lot reference, the invoiced object identifier and the supporting document group into the same element and tells them apart by ram:TypeCode; the source states that condition for BT-17, BT-18 and BT-122 and omits it here. Without it every additional reference of any kind opens a supporting document group, and a reference that stands before the supporting document in the file moves that document's occurrence index, which is part of its semantic path. The condition 916 is the one the CEN validation artefact of packs/ writes on this element for BT-123 and BT-125."
    },
    {
      "member": "terms",
      "from": "/rsm:CrossIndustryInvoice/rsm:SupplyChainTradeTransaction/ram:ApplicableHeaderTradeAgreement/ram:AdditionalReferencedDocument/ram:Name",
      "to": "/rsm:CrossIndustryInvoice/rsm:SupplyChainTradeTransaction/ram:ApplicableHeaderTradeAgreement/ram:AdditionalReferencedDocument[ram:TypeCode = '916']/ram:Name",
      "reason": "The syntax writes the tender or lot reference, the invoiced object identifier and the supporting document group into the same element and tells them apart by ram:TypeCode; the source states that condition for BT-17, BT-18 and BT-122 and omits it here. Without it every additional reference of any kind opens a supporting document group, and a reference that stands before the supporting document in the file moves that document's occurrence index, which is part of its semantic path. The condition 916 is the one the CEN validation artefact of packs/ writes on this element for BT-123 and BT-125."
    },
    {
      "member": "terms",
      "from": "/rsm:CrossIndustryInvoice/rsm:SupplyChainTradeTransaction/ram:ApplicableHeaderTradeAgreement/ram:AdditionalReferencedDocument/ram:URIID",
      "to": "/rsm:CrossIndustryInvoice/rsm:SupplyChainTradeTransaction/ram:ApplicableHeaderTradeAgreement/ram:AdditionalReferencedDocument[ram:TypeCode = '916']/ram:URIID",
      "reason": "The syntax writes the tender or lot reference, the invoiced object identifier and the supporting document group into the same element and tells them apart by ram:TypeCode; the source states that condition for BT-17, BT-18 and BT-122 and omits it here. Without it every additional reference of any kind opens a supporting document group, and a reference that stands before the supporting document in the file moves that document's occurrence index, which is part of its semantic path. The condition 916 is the one the CEN validation artefact of packs/ writes on this element for BT-123 and BT-125."
    },
    {
      "member": "terms",
      "from": "/rsm:CrossIndustryInvoice/rsm:SupplyChainTradeTransaction/ram:ApplicableHeaderTradeAgreement/ram:AdditionalReferencedDocument/ram:AttachmentBinaryObject",
      "to": "/rsm:CrossIndustryInvoice/rsm:SupplyChainTradeTransaction/ram:ApplicableHeaderTradeAgreement/ram:AdditionalReferencedDocument[ram:TypeCode = '916']/ram:AttachmentBinaryObject",
      "reason": "The syntax writes the tender or lot reference, the invoiced object identifier and the supporting document group into the same element and tells them apart by ram:TypeCode; the source states that condition for BT-17, BT-18 and BT-122 and omits it here. Without it every additional reference of any kind opens a supporting document group, and a reference that stands before the supporting document in the file moves that document's occurrence index, which is part of its semantic path. The condition 916 is the one the CEN validation artefact of packs/ writes on this element for BT-123 and BT-125."
    },
    {
      "member": "terms",
      "from": "/rsm:CrossIndustryInvoice/rsm:SupplyChainTradeTransaction/ram:IncludedSupplyChainTradeLineItem/ram:SpecifiedLineTradeAgreement/ram:NetPriceProductTradePrice/ram:BasisQuantity/@UnitCode",
      "to": "/rsm:CrossIndustryInvoice/rsm:SupplyChainTradeTransaction/ram:IncludedSupplyChainTradeLineItem/ram:SpecifiedLineTradeAgreement/ram:NetPriceProductTradePrice/ram:BasisQuantity/@unitCode",
      "reason": "The quantity type of UN/CEFACT CII D16B carries the unit of measure on an attribute named unitCode, and the schema modules of that syntax declare no attribute named UnitCode on it or on anything else. Every other unit of measure the source binds, in this syntax and in the two UBL ones, is bound to the attribute with the lower case first letter."
    }
  ],
  "conventions": [],
  "flagDefinitions": {
    "CAR-2": "The semantic model requires the term where the syntax leaves the element optional.",
    "CAR-3": "The syntax lets the element repeat where the semantic model allows the term only once.",
    "CAR-4": "The syntax bounds the element more narrowly than the semantic model bounds the term.",
    "SEM-2": "The syntax element is semantically wider than the term; a predicate or a convention picks out the occurrence that carries it.",
    "STR-2": "The syntax nests the element inside a group that the semantic model places it outside of.",